{
  "schemaVersion": "1.0.0",
  "projectId": "snowbound-hotel",
  "storyVersion": 1,
  "productionVersion": 1,
  "status": "PLANNING",
  "directorTreatment": {
    "visualLanguage": "写实电影摄影，低饱和冬季质感",
    "cameraGrammar": "稳定的封闭构图逐步过渡到手持近景，强调门框、镜面与监控视角",
    "performanceDirection": "克制表演，以停顿、视线和微动作传达角色隐瞒的信息。",
    "editingRhythm": "前段长镜头积压不信任，证据出现后缩短镜头并增加反应切换。",
    "soundDirection": "暴雪低频、建筑管道声与近距离呼吸构成主要声场。",
    "continuityRules": [
      "角色面部、发型与冬季服装必须继承 LOCKED reference",
      "地点朝向与关键道具位置固定"
    ]
  },
  "characters": [
    {
      "characterId": "journalist",
      "appearancePrompt": "三十岁上下、清瘦、神情警觉，深灰羽绒服与旧皮质相机带",
      "negativeConstraints": [
        "左眉尾小疤保持一致"
      ],
      "costumeVariants": [
        "深灰羽绒服与旧皮质相机带"
      ],
      "voiceProfile": {
        "voiceId": null,
        "referenceAssetId": null,
        "language": "zh-CN",
        "style": "快速、直接",
        "emotion": "克制焦虑",
        "speed": 1.05
      },
      "assetLock": {
        "status": "DRAFT",
        "revision": 1,
        "canonicalReferenceAssetIds": []
      },
      "providerMetadata": {
        "provider": "unconfigured"
      }
    },
    {
      "characterId": "detective",
      "appearancePrompt": "四十岁、短发、疲惫但锐利，深色羊毛大衣与便装枪套",
      "negativeConstraints": [
        "右手旧伤动作受限"
      ],
      "costumeVariants": [
        "深色羊毛大衣与便装枪套"
      ],
      "voiceProfile": {
        "voiceId": null,
        "referenceAssetId": null,
        "language": "zh-CN",
        "style": "低沉、审讯式停顿",
        "emotion": "冷静",
        "speed": 0.9
      },
      "assetLock": {
        "status": "DRAFT",
        "revision": 1,
        "canonicalReferenceAssetIds": []
      },
      "providerMetadata": {
        "provider": "unconfigured"
      }
    },
    {
      "characterId": "psychologist",
      "appearancePrompt": "三十五岁、神态沉静、观察力强，米白高领毛衣与墨绿色冬季长外套",
      "negativeConstraints": [
        "始终佩戴银色细框眼镜"
      ],
      "costumeVariants": [
        "米白高领毛衣与墨绿色冬季长外套"
      ],
      "voiceProfile": {
        "voiceId": null,
        "referenceAssetId": null,
        "language": "zh-CN",
        "style": "轻声、善用反问",
        "emotion": "安抚中带警觉",
        "speed": 0.92
      },
      "assetLock": {
        "status": "DRAFT",
        "revision": 1,
        "canonicalReferenceAssetIds": []
      },
      "providerMetadata": {
        "provider": "unconfigured"
      }
    },
    {
      "characterId": "owner",
      "appearancePrompt": "五十岁、仪表精致、眼神疲惫，剪裁考究的深蓝西装与冬季羊绒外套",
      "negativeConstraints": [
        "金色袖扣必须一致"
      ],
      "costumeVariants": [
        "剪裁考究的深蓝西装与冬季羊绒外套"
      ],
      "voiceProfile": {
        "voiceId": null,
        "referenceAssetId": null,
        "language": "zh-CN",
        "style": "礼貌、迂回、控制谈话",
        "emotion": "压抑愤怒",
        "speed": 0.95
      },
      "assetLock": {
        "status": "DRAFT",
        "revision": 1,
        "canonicalReferenceAssetIds": []
      },
      "providerMetadata": {
        "provider": "unconfigured"
      }
    },
    {
      "characterId": "actor",
      "appearancePrompt": "二十八岁、镜头感强、神情易变，黑色冬季礼服外搭银灰羽绒披肩",
      "negativeConstraints": [
        "耳后星形纹身只在特定角度可见"
      ],
      "costumeVariants": [
        "黑色冬季礼服外搭银灰羽绒披肩"
      ],
      "voiceProfile": {
        "voiceId": null,
        "referenceAssetId": null,
        "language": "zh-CN",
        "style": "精确、表演性强",
        "emotion": "从容伪装",
        "speed": 1
      },
      "assetLock": {
        "status": "DRAFT",
        "revision": 1,
        "canonicalReferenceAssetIds": []
      },
      "providerMetadata": {
        "provider": "unconfigured"
      }
    },
    {
      "characterId": "brother",
      "appearancePrompt": "二十六岁、面色苍白、压抑怒意，磨损的军绿色冬季夹克",
      "negativeConstraints": [
        "左手腕烧伤痕迹"
      ],
      "costumeVariants": [
        "磨损的军绿色冬季夹克"
      ],
      "voiceProfile": {
        "voiceId": null,
        "referenceAssetId": null,
        "language": "zh-CN",
        "style": "少言、突然爆发",
        "emotion": "压抑仇恨",
        "speed": 0.88
      },
      "assetLock": {
        "status": "DRAFT",
        "revision": 1,
        "canonicalReferenceAssetIds": []
      },
      "providerMetadata": {
        "provider": "unconfigured"
      }
    }
  ],
  "locations": [
    {
      "locationId": "location-lobby",
      "visualPrompt": "深色木饰面、旧铜灯、被雪光切开的宽阔空间",
      "negativeConstraints": [
        "壁炉位于北墙",
        "前台后方有旧机械钥匙墙"
      ],
      "assetLock": {
        "status": "DRAFT",
        "revision": 1,
        "canonicalReferenceAssetIds": []
      },
      "providerMetadata": {
        "provider": "unconfigured"
      }
    },
    {
      "locationId": "location-archive",
      "visualPrompt": "低矮水泥空间、锈蚀管线、绿色应急灯与成排铁柜",
      "negativeConstraints": [
        "唯一出口在东侧",
        "第七号档案柜损坏"
      ],
      "assetLock": {
        "status": "DRAFT",
        "revision": 1,
        "canonicalReferenceAssetIds": []
      },
      "providerMetadata": {
        "provider": "unconfigured"
      }
    }
  ],
  "scenes": [
    {
      "sceneId": "scene-lobby",
      "title": "停电后的第一轮指控",
      "locationId": "location-lobby",
      "script": "大堂应急灯亮起。每个人的脸都被壁炉火光切成明暗两半。",
      "status": "BLOCKED",
      "shots": [
        {
          "id": "shot-scene-lobby-wide",
          "sceneId": "scene-lobby",
          "characters": [
            "journalist",
            "detective",
            "psychologist",
            "owner",
            "actor",
            "brother"
          ],
          "location": "location-lobby",
          "description": "停电后的第一轮指控的空间建立镜头",
          "dialogue": [],
          "camera": "35mm wide, locked frame, slow push-in",
          "shotSize": "LS",
          "cameraMovement": "slow push-in",
          "duration": 8,
          "imagePrompt": "写实电影摄影，低饱和冬季质感，停电后的第一轮指控，空间建立镜头",
          "videoPrompt": "稳定的封闭构图逐步过渡到手持近景，强调门框、镜面与监控视角，缓慢推进，保持角色与地点一致",
          "referenceImages": [],
          "voiceAssets": [],
          "subtitle": [],
          "sfx": [
            "暴雪",
            "建筑低频"
          ],
          "bgm": [
            "低频氛围铺底"
          ],
          "status": "BLOCKED",
          "retryCount": 0,
          "providerMetadata": {
            "provider": "unconfigured"
          }
        },
        {
          "id": "shot-scene-lobby-dialogue",
          "sceneId": "scene-lobby",
          "characters": [
            "journalist",
            "detective"
          ],
          "location": "location-lobby",
          "description": "停电后的第一轮指控的关键对白与反应镜头",
          "dialogue": [
            {
              "characterId": "journalist",
              "text": "大堂应急灯亮起。每个人的脸都被壁炉火光切成明暗两半。"
            }
          ],
          "camera": "50mm medium close-up with reverse reaction",
          "shotSize": "MCU",
          "cameraMovement": "subtle handheld",
          "duration": 8,
          "imagePrompt": "写实电影摄影，低饱和冬季质感，停电后的第一轮指控，克制表演，中近景",
          "videoPrompt": "稳定的封闭构图逐步过渡到手持近景，强调门框、镜面与监控视角，自然微表情，轻微手持",
          "referenceImages": [],
          "voiceAssets": [],
          "subtitle": [],
          "sfx": [
            "暴雪",
            "建筑低频"
          ],
          "bgm": [
            "低频氛围铺底"
          ],
          "status": "BLOCKED",
          "retryCount": 0,
          "providerMetadata": {
            "provider": "unconfigured"
          }
        }
      ]
    },
    {
      "sceneId": "scene-archive",
      "title": "第七号档案柜",
      "locationId": "location-archive",
      "script": "第七号铁柜被拉开，发霉的账册和一部仍亮着微光的手机同时出现。",
      "status": "BLOCKED",
      "shots": [
        {
          "id": "shot-scene-archive-wide",
          "sceneId": "scene-archive",
          "characters": [
            "journalist",
            "detective",
            "psychologist",
            "owner",
            "actor",
            "brother"
          ],
          "location": "location-archive",
          "description": "第七号档案柜的空间建立镜头",
          "dialogue": [],
          "camera": "35mm wide, locked frame, slow push-in",
          "shotSize": "LS",
          "cameraMovement": "slow push-in",
          "duration": 8,
          "imagePrompt": "写实电影摄影，低饱和冬季质感，第七号档案柜，空间建立镜头",
          "videoPrompt": "稳定的封闭构图逐步过渡到手持近景，强调门框、镜面与监控视角，缓慢推进，保持角色与地点一致",
          "referenceImages": [],
          "voiceAssets": [],
          "subtitle": [],
          "sfx": [
            "暴雪",
            "建筑低频"
          ],
          "bgm": [
            "低频氛围铺底"
          ],
          "status": "BLOCKED",
          "retryCount": 0,
          "providerMetadata": {
            "provider": "unconfigured"
          }
        },
        {
          "id": "shot-scene-archive-dialogue",
          "sceneId": "scene-archive",
          "characters": [
            "journalist",
            "detective"
          ],
          "location": "location-archive",
          "description": "第七号档案柜的关键对白与反应镜头",
          "dialogue": [
            {
              "characterId": "journalist",
              "text": "第七号铁柜被拉开，发霉的账册和一部仍亮着微光的手机同时出现。"
            }
          ],
          "camera": "50mm medium close-up with reverse reaction",
          "shotSize": "MCU",
          "cameraMovement": "subtle handheld",
          "duration": 8,
          "imagePrompt": "写实电影摄影，低饱和冬季质感，第七号档案柜，克制表演，中近景",
          "videoPrompt": "稳定的封闭构图逐步过渡到手持近景，强调门框、镜面与监控视角，自然微表情，轻微手持",
          "referenceImages": [],
          "voiceAssets": [],
          "subtitle": [],
          "sfx": [
            "暴雪",
            "建筑低频"
          ],
          "bgm": [
            "低频氛围铺底"
          ],
          "status": "BLOCKED",
          "retryCount": 0,
          "providerMetadata": {
            "provider": "unconfigured"
          }
        }
      ]
    },
    {
      "sceneId": "ending-truth",
      "title": "暴雪中的直播",
      "locationId": "location-lobby",
      "script": "证据在通讯恢复前被上传，所有人的秘密同时暴露。",
      "status": "BLOCKED",
      "shots": [
        {
          "id": "shot-ending-truth-resolution",
          "sceneId": "ending-truth",
          "characters": [
            "journalist"